commit	opponent	point_rate	search_score	lower_ci	games	complexity	status	description
probe	B4	0.64261	0.79329	0.64085	200000	100	discard	exp WX ABLATE hand>=opp off (TQ pile) batch-102
probe	B4	0.64396	0.79451	0.64220	200000	100	discard	exp WY COMBO WR+rank-match pile batch-102
probe	B4	0.59579	0.76185	0.59403	200000	100	discard	exp WZ SWEEP hand>opp pile gate batch-102
probe	B4	0.59579	0.76185	0.59403	200000	100	discard	exp XA SWEEP hand>=opp+1 pile gate batch-102
probe	B4	0.64387	0.79450	0.64211	200000	100	discard	exp XB COMBO WR+deck>=6 midgame pair batch-102
probe	B4	0.64386	0.79444	0.64210	200000	100	discard	exp XC ABLATE total<=16 gate off batch-103
probe	B4	0.63518	0.78155	0.63342	200000	100	discard	exp XD ABLATE strip opp<=2 off batch-103
probe	B4	0.62957	0.77874	0.62781	200000	100	discard	exp XE COMBO WR+pile opp<=4 batch-103
probe	B4	0.64382	0.79443	0.64206	200000	100	discard	exp XF PIVOT pile deck<=2 only batch-103
probe	B4	0.64389	0.79447	0.64213	200000	100	discard	exp XG SWEEP total gate <=14 batch-104
probe	B4	0.64389	0.79447	0.64213	200000	100	discard	exp XH SWEEP total gate <=15 batch-104
probe	B4	0.64396	0.79451	0.64220	200000	100	discard	exp XI SWEEP total gate <=17 batch-104
probe	B4	0.63743	0.78267	0.63567	200000	100	discard	exp XJ ABLATE deck==0 pair only batch-104
probe	B4	0.64396	0.79451	0.64220	200000	100	discard	exp XK COMBO WR void pile -10 batch-104
probe	B4	0.64377	0.79440	0.64201	200000	100	discard	exp XL PIVOT pile opp<=6 batch-104
probe	B4	0.62204	0.77498	0.62028	200000	100	discard	exp XM PIVOT pile trump deck==0 only batch-105
probe	B4	0.64284	0.79343	0.64108	200000	100	discard	exp XN PIVOT midgame pair min+1 cap batch-105
probe	B4	0.64396	0.79451	0.64220	200000	100	discard	exp XO PIVOT pile void rank-aware batch-105
probe	B4	0.62204	0.77498	0.62028	200000	100	discard	exp XP PIVOT pile pass only-trump deck>0 batch-106
probe	B4	0.64396	0.79451	0.64220	200000	100	discard	exp XQ PIVOT open lowest-suit tie-break batch-106
probe	B4	0.64265	0.79359	0.64089	200000	100	discard	exp XR PIVOT endgame pair skip min+2 batch-106
probe	B4	0.62350	0.77571	0.62174	200000	100	discard	exp XS PIVOT ultra-endgame pass hand==1 deck==0 batch-107
probe	B4	0.64666	0.79598	0.64490	200000	100	discard	exp XT PIVOT defense rank-match cover -3 batch-107
probe	B4	0.64480	0.79505	0.64304	500000	100	discard	exp XT PIVOT defense rank-match cover -3 medium batch-107
probe	B4	0.64396	0.79451	0.64220	400000	100	discard	exp XU WR dual seed reconfirm batch-107
probe	B4	0.64594	0.79559	0.64418	200000	100	discard	exp XV SWEEP defense rank-match -2 batch-108
probe	B4	0.64585	0.79560	0.64409	200000	100	discard	exp XW SWEEP defense rank-match -4 batch-108
probe	B4	0.64300	0.79426	0.64124	200000	100	discard	exp XX SWEEP defense rank-match -6 batch-108
probe	B4	0.64396	0.79451	0.64220	200000	100	discard	exp XY PIVOT pass hand==2 opp==1 deck==0 batch-108
probe	B4	0.64637	0.79595	0.64461	500000	100	discard	exp XW defense rank-match -4 medium confirm batch-109
probe	B4	0.64396	0.79451	0.64220	200000	100	discard	exp XZ PIVOT open trump hoard deck>=4 trumps>=3 batch-109
probe	B4	0.64397	0.79451	0.64221	200000	100	discard	exp YA PIVOT pile void only hand>=opp batch-109
probe	B4	0.64585	0.79560	0.64409	400000	100	discard	exp YB COMBO WR+defense rank-match -4 dual batch-110
probe	B4	0.64637	0.79595	0.64461	500000	100	discard	exp YB COMBO WR+defense rank-match -4 dual medium batch-110
probe	B4	0.63245	0.78018	0.63069	200000	100	discard	exp YC PIVOT strip opp==1 only on WR batch-110
probe	B4	0.64410	0.79458	0.64234	200000	100	discard	exp YD PIVOT midgame pair only hand>=opp on WR batch-110
probe	B4	0.63091	0.77941	0.62915	200000	100	discard	exp YE PIVOT pass throw-in n_table>=4 on WR batch-111
probe	B4	0.64390	0.79445	0.64214	200000	100	discard	exp YF PIVOT endgame pair total<=18 on WR batch-111
probe	B4	0.58440	0.75616	0.58264	200000	100	discard	exp YG ABLATE pile trump dump off batch-112
probe	B4	0.63980	0.78386	0.63804	200000	100	discard	exp YH ABLATE midgame pair path off batch-112
probe	B4	0.64382	0.79443	0.64206	200000	100	discard	exp YI ABLATE void penalty off batch-112
probe	B4	0.63743	0.78267	0.63567	200000	100	discard	exp YJ ABLATE deck<=2 pair (CZ deck==0 only) batch-112
probe	B4	0.63518	0.78155	0.63342	200000	100	discard	exp YK ABLATE strip opp<=2 off batch-112
probe	B4	0.64396	0.79451	0.64220	400000	100	discard	exp YP WR dual seed reconfirm batch-113
probe	B4	0.64379	0.79479	0.64203	200000	100	discard	exp YL PIVOT open shortest-suit dump tie-break batch-113
probe	B4	0.64396	0.79451	0.64220	200000	100	discard	exp YM PIVOT pile rank hand-depth bonus batch-113
probe	B4	0.64396	0.79451	0.64220	200000	100	discard	exp YN PIVOT defense tight-beat overkill penalty batch-113
probe	B4	0.64396	0.79451	0.64220	200000	100	discard	exp YO PIVOT open pass deck==0 opp==1 hand==2 batch-113
f5bb135	B3vsB2	0.50000	0.79506	0.50000	10000000	100	keep	WR post-plateau memory ablation batch-114
probe	B4	0.645940	0.795520	0.644180	200000	100	discard	exp ZA: defense keep non-trump pairs (jun25 b1 quick)
probe	B4	0.647010	0.796350	0.645270	200000	100	discard	exp ZB: defense reuse table rank -4 (jun25 b1 quick)
probe	B4	0.648390	0.797030	0.646650	1000000	100	discard	exp ZC: defense pair-keep + rank-reuse combo (jun25 b1 medium)
probe	B4	0.648740	0.798350	0.647000	1000000	100	discard	exp ZI: ZC + high-trump take rank>=7 deck>=6 (jun25 b1 medium)
probe	B4	0.648890	0.799240	0.647150	1000000	100	discard	exp ZK: ZC + take rank>=6 deck>=5 (jun25 b1 medium)
probe	B4	0.649520	0.800400	0.647780	200000	100	discard	exp ZM: ZC + take rank>=5 deck>=5 (jun25 b1 quick)
probe	B4	0.647820	0.800150	0.646080	1000000	100	discard	exp ZN: ZC + take rank>=4 deck>=5 (jun25 b1 medium)
ab2d08c	B4	0.648050	0.800250	0.647790	10000000	100	keep	exp ZN: defense shape-aware + high-trump conservation take (jun25 b1 full)
ab2d08c	B1	0.970460	0.800250	0.970360	10000000	100	keep	exp ZN: B1 ladder rung (jun25 b1 full)
ab2d08c	B0	0.975440	0.800250	0.975350	10000000	100	keep	exp ZN: B0 ladder rung (jun25 b1 full)
ab2d08c	B3vsB2	0.499200	0.800250	0.499130	10000000	100	keep	exp ZN memory ablation: defense shape uses no memory (jun25 b1)
probe	B4	0.683040	0.820010	0.681210	200000	100	discard	exp ZU: high-trump take widen n_table<=4 (jun25 b2 quick)
probe	B4	0.683350	0.820330	0.681520	200000	100	discard	exp ZV: take no n_table cap rank>=4 deck>=5 (jun25 b2 quick)
probe	B4	0.688000	0.823600	0.686160	200000	100	discard	exp ZW: take no cap rank>=3 deck>=5 PEAK (jun25 b2 quick)
probe	B4	0.686480	0.823610	0.684620	200000	100	discard	exp ZX: take rank>=2 flat-search higher-loss (jun25 b2 quick)
probe	B4	0.675580	0.817350	0.673710	200000	100	discard	exp ZY: take rank>=3 deck>=4 regress (jun25 b2 quick)
probe	B4	0.687400	0.822980	0.685560	200000	100	discard	exp ZZ: take rank>=3 deck>=6 slightly worse (jun25 b2 quick)
probe	B4	0.684910	0.821790	0.684080	1000000	100	discard	exp ZW: rank>=3 deck>=5 no-cap medium confirm (jun25 b2)
310bc72	B4	0.684940	0.821760	0.684680	10000000	100	keep	exp ZW: high-trump conservation take widened rank>=3 deck>=5 any pile (jun25 b2 full)
310bc72	B1	0.972600	0.821760	0.972500	10000000	100	keep	exp ZW: B1 ladder rung (jun25 b2 full)
310bc72	B0	0.987570	0.821760	0.987500	10000000	100	keep	exp ZW: B0 ladder rung (jun25 b2 full)
310bc72	B3vsB2	0.499150	0.821760	0.499070	10000000	100	keep	exp ZW memory ablation: conservation take uses no memory (jun25 b2)
probe	B4	0.685510	0.822390	0.683670	200000	100	discard	exp R5: rank-reuse -5 on ZW base flat (jun25 b3 quick)
probe	B4	0.683680	0.821510	0.681840	200000	100	discard	exp R6: rank-reuse -6 on ZW base worse (jun25 b3 quick)
probe	B4	0.687930	0.823280	0.686100	200000	100	discard	exp QB: ablate rank-reuse off -- signal now HARMFUL +0.0015 (jun25 b3 quick)
probe	B4	0.687280	0.822850	0.687020	10000000	100	discard	exp QC: ablate both shape off (take-only) rank>=3 (jun25 b3 full)
probe	B4	0.682340	0.819530	0.680530	200000	100	discard	exp QD: take-only rank>=4 regress (jun25 b3 quick)
probe	B4	0.687320	0.824660	0.685460	200000	100	discard	exp QE: take-only rank>=1 regress higher-loss (jun25 b3 quick)
probe	B4	0.675340	0.801630	0.673470	200000	100	discard	exp QF: take-only rank>=2 deck>=4 collapse (jun25 b3 quick)
8487eb7	B4	0.689030	0.824640	0.688770	10000000	100	keep	exp QA: drop defense shape tie-breaks + take rank>=2 (jun25 b3 full)
8487eb7	B1	0.975190	0.824640	0.975100	10000000	100	keep	exp QA: B1 ladder rung (jun25 b3 full)
8487eb7	B0	0.987820	0.824640	0.987750	10000000	100	keep	exp QA: B0 ladder rung (jun25 b3 full)
8487eb7	B3vsB2	0.500000	0.824640	0.500000	10000000	100	keep	exp QA memory ablation: identical play, memory fully inert (jun25 b3)
probe	B4	0.645190	0.786550	0.643420	200000	100	discard	exp SA: take gated hand<=opp -0.038 catastrophic (jun25 b4 quick)
probe	B4	0.689160	0.824760	0.688340	1000000	100	discard	exp SC: attack pile pair-keep inert at medium (jun25 b4)
probe	B4	0.680650	0.804280	0.678810	200000	100	discard	exp SD: take gated opp_hand>=4 -0.020 (jun25 b4 quick)
probe	B4	0.689160	0.824950	0.688340	1000000	100	discard	exp SE: trump-attack take floor rank>=1 inert at medium (jun25 b5)
probe	B4	0.656370	0.792140	0.654470	200000	100	discard	exp TA: throw-in early-stop opp<=2 endgame -0.033 catastrophic (jun25 b6 quick)
probe	B4	0.689210	0.824650	0.688390	1000000	100	discard	exp TB: open-from-longest-suit tie-break inert at medium (jun25 b6)
probe	B4	0.689160	0.824760	0.688340	1000000	100	discard	exp TE: table-trump take proxy (rank>=1 if >=2 table trumps) inert at medium (jun25 b6)
probe	B4	0.689160	0.824760	0.688340	1000000	100	discard	exp UA: defense suit-void cover bonus (-2 last-of-suit) inert at medium (jun25 b7)
probe	B4	0.486780	0.707350	0.484880	200000	100	discard	exp UB: endgame never-burn-trump-K/A take -0.202 catastrophic (jun25 b7 quick)
p r o b e 	 B 4 	 0 . 6 8 9 3 2 0 	 0 . 8 2 4 6 1 0 	 0 . 6 8 7 4 8 0 	 2 0 0 0 0 0 	 1 0 0 	 d i s c a r d 	 e x p   g e m i n i   b 1 :   d e f e n s e   a l l - t r u m p   h a n d   d o n ' t   b u r n   t r u m p   t a k e   ( q u i c k   i n e r t )  
 p r o b e 	 B 4 	 0 . 6 8 9 0 2 0 	 0 . 8 2 4 8 2 0 	 0 . 6 8 8 1 9 0 	 1 0 0 0 0 0 0 	 1 0 0 	 d i s c a r d 	 e x p   g e m i n i   b 2 :   o p e n   s h o r t e s t   s u i t   ( m e d i u m   i n e r t )  
 p r o b e 	 B 4 	 0 . 6 9 0 4 0 0 	 0 . 8 2 5 6 1 0 	 0 . 6 8 8 5 6 0 	 2 0 0 0 0 0 	 1 0 0 	 d i s c a r d 	 e x p   g e m i n i   b 3 :   e n d g a m e   t h r o w - i n   l a s t   t r u m p   g u a r a n t e e d   w i n   ( q u i c k   i n e r t )  
 p r o b e 	 B 4 	 0 . 6 7 3 7 3 0 	 0 . 8 0 0 8 2 0 	 0 . 6 7 1 8 7 0 	 2 0 0 0 0 0 	 1 0 0 	 d i s c a r d 	 e x p   g e m i n i   b 4 :   d o   n o t   p i l e   h i g h   n o n - t r u m p s   e a r l y   g a m e   ( q u i c k   - 0 . 0 1 5 )  
 p r o b e 	 B 4 	 0 . 6 9 0 0 8 0 	 0 . 8 2 5 4 3 0 	 0 . 6 8 8 2 4 0 	 2 0 0 0 0 0 	 1 0 0 	 d i s c a r d 	 e x p   g e m i n i   b 5 :   m i d g a m e   o p e n   p r i o r i t i z e   t r i p l e s   o v e r   p a i r s   ( q u i c k   i n e r t )  
 p r o b e 	 B 4 	 0 . 6 9 0 2 4 0 	 0 . 8 2 5 5 3 0 	 0 . 6 8 8 4 0 0 	 2 0 0 0 0 0 	 1 0 0 	 d i s c a r d 	 e x p   g e m i n i   b 6 :   P I V O T   a t t a c k   p i l e   p r e f e r   m a t c h i n g   d e f e n d e r ' s   r a n k   ( q u i c k   i n e r t )  
 p r o b e 	 B 4 	 0 . 6 6 5 9 9 0 	 0 . 7 9 6 9 5 0 	 0 . 6 6 4 1 1 0 	 2 0 0 0 0 0 	 1 0 0 	 d i s c a r d 	 e x p   g e m i n i   b 7 :   P I V O T   h o l d   h i g h   n o n - t r u m p s   i n   p i l e   i f   0   t r u m p s   ( q u i c k   - 0 . 0 2 3 )  
 p r o b e 	 B 4 	 0 . 6 8 4 6 1 0 	 0 . 8 2 1 1 3 0 	 0 . 6 8 2 7 6 0 	 2 0 0 0 0 0 	 1 0 0 	 d i s c a r d 	 e x p   g e m i n i   b 8 :   e n d g a m e   o p e n   h i g h e s t   n o n - t r u m p   i f   0   t r u m p s   ( q u i c k   - 0 . 0 0 4 )  
 p r o b e 	 B 4 	 0 . 6 3 5 9 4 0 	 0 . 7 8 1 9 3 0 	 0 . 6 3 4 0 6 0 	 2 0 0 0 0 0 	 1 0 0 	 d i s c a r d 	 e x p   g e m i n i   b 9 :   P I V O T   d o   n o t   d u m p   h i g h   t r u m p s   ( Q ,   K ,   A )   i n t o   t h e   f i n i s h   p i l e   ( q u i c k   - 0 . 0 5 3 )  
 p r o b e 	 B 4 	 0 . 6 8 9 5 8 0 	 0 . 8 2 5 1 9 0 	 0 . 6 8 7 7 4 0 	 2 0 0 0 0 0 	 1 0 0 	 d i s c a r d 	 e x p   g e m i n i   b 1 0 :   P I V O T   a t t a c k   p i l e   p r i o r i t i z e   H I G H E S T   n o n - t r u m p s   ( q u i c k   i n e r t )  
 p r o b e 	 B 4 	 0 . 6 9 0 1 6 0 	 0 . 8 2 5 4 9 0 	 0 . 6 8 8 3 2 0 	 2 0 0 0 0 0 	 1 0 0 	 d i s c a r d 	 e x p   g e m i n i   b 1 1 :   P I V O T   p e n a l i z e   b r e a k i n g   n o n - t r u m p   p a i r s   d u r i n g   p i l e   p h a s e   ( q u i c k   i n e r t )  
 