commit	opponent	point_rate	search_score	lower_ci	games	complexity	status	description
probe	B4	0.631430	0.779670	0.629690	200000	100	discard	exp OL pair-open deck>=4 batch-63
probe	B4	0.636070	0.788960	0.634330	200000	100	discard	exp OM void bonus -7 open batch-63
probe	B4	0.607180	0.767550	0.605440	200000	100	discard	exp ON pile trump opp<=3 batch-63
probe	B4	0.636070	0.788960	0.634330	200000	100	discard	exp OO defend same-suit -3 batch-63
probe	B4	0.642090	0.792090	0.640350	200000	100	discard	exp OX HD + pass n_table>=5 batch-64
probe	B4	0.643090	0.793590	0.641350	500000	100	discard	exp OY HD + new-suit bonus -3 medium batch-64
probe	B4	0.635840	0.788850	0.634090	200000	100	discard	exp OZ new-suit bonus -3 CZ batch-64
probe	B4	0.586700	0.756700	0.584960	200000	100	discard	exp PA skip pile trump n_table<3 batch-64
probe	B4	0.624060	0.774060	0.622320	200000	100	discard	exp PB open mnt+1 deck>=5 batch-64
probe	B4	0.083750	0.505830	0.082010	200000	100	discard	exp PC take all-trump covers deck<=3 batch-65
probe	B4	0.054180	0.491050	0.052440	200000	100	discard	exp PD skip trump vs non-trump attack batch-65
probe	B4	0.636070	0.788960	0.634330	200000	100	discard	exp PE defend cost + rank gap batch-65
probe	B4	0.625030	0.776470	0.623290	200000	100	discard	exp PF take all-trump n_table>=4 batch-65
probe	B4	0.636070	0.788960	0.634330	200000	100	discard	exp PG defend same-suit -3 batch-65
probe	B4	0.636070	0.788960	0.634330	200000	100	discard	exp PH take min-trump if NT exists deck<=3 batch-66
probe	B4	0.636070	0.788960	0.634330	200000	100	discard	exp PJ defense trump penalty +40 batch-66
probe	B4	0.636070	0.788960	0.634330	200000	100	discard	exp PK defense trump penalty +60 batch-66
probe	B4	0.636070	0.788960	0.634330	200000	100	discard	exp PL defense trump penalty +55 batch-66
probe	B4	0.636070	0.788960	0.634330	200000	100	discard	exp PM PH logic deck<=2 batch-66
probe	B4	0.625590	0.777590	0.623850	200000	100	discard	exp PN strip opp<=3 CZ batch-67
probe	B4	0.635780	0.788780	0.634040	200000	100	discard	exp PO pile trump deck<=2 batch-67
probe	B4	0.642240	0.792240	0.640500	200000	100	discard	exp PP HD + pile deck<=2 batch-67
probe	B4	0.631290	0.779670	0.629550	200000	100	discard	exp PQ HD + strip opp<=3 batch-67
probe	B4	0.631320	0.779620	0.629580	200000	100	discard	exp PR pair-open opp<=4 gate batch-67
probe	B4	0.626820	0.777370	0.625080	200000	100	discard	exp PS strip hand<=3 batch-68
probe	B4	0.575230	0.751570	0.573490	200000	100	discard	exp PT pile trump hand<=4 batch-68
probe	B4	0.636070	0.788960	0.634330	200000	100	discard	exp PU pair-open opp>=5 batch-68
probe	B4	0.630970	0.779440	0.629230	200000	100	discard	exp PV pile pass hand<=2 trump batch-68
probe	B4	0.636070	0.788960	0.634330	200000	100	discard	exp PW open trump hand<=2 no NT batch-68
probe	B4	0.624210	0.774210	0.622470	200000	100	discard	exp PY strip hand<=2 batch-69
probe	B4	0.626820	0.777370	0.625080	200000	100	discard	exp PZ strip hand<=3 deck<=2 batch-69
probe	B4	0.584780	0.756780	0.583040	200000	100	discard	exp QA HD + pile hand<=4 batch-69
probe	B4	0.636070	0.788960	0.634330	200000	100	discard	exp QB pair-open opp>=4 batch-69
probe	B4	0.601070	0.771070	0.599330	200000	100	discard	exp QC pile hand<=3 deck<=3 batch-69
probe	B4	0.636070	0.788960	0.634330	200000	100	discard	exp QD void -10 pile n_table>=2 batch-70
probe	B4	0.586700	0.756700	0.584960	200000	100	discard	exp QE pile trump n_table>=3 batch-70
probe	B4	0.636070	0.788960	0.634330	200000	100	discard	exp QF pair-open n_table==0 batch-70
probe	B4	0.643230	0.793650	0.642450	500000	100	discard	exp HD medium control batch-71
probe	B4	0.642090	0.792090	0.640350	200000	100	discard	exp QG HD + n_table>=5 pass batch-71
probe	B4	0.642530	0.793220	0.640770	200000	100	discard	exp QH HD + void -10 n_table>=2 batch-71
probe	B4	0.642240	0.792240	0.640500	200000	100	discard	exp QI HD + pile deck<=2 batch-71
probe	B4	0.641570	0.791570	0.639830	200000	100	discard	exp QJ HD + strip opp==2 batch-71
probe	B4	0.642740	0.793400	0.641000	500000	100	discard	exp QG HD + n_table pass medium batch-71
probe	B4	0.642940	0.793450	0.641200	500000	100	discard	exp QI HD + pile deck<=2 medium batch-71
probe	B4	0.643090	0.793590	0.641350	500000	100	discard	exp QK HD + new-suit -3 medium batch-71
probe	B4	0.642350	0.793140	0.640610	200000	100	discard	exp QK HD + new-suit -3 fixed batch-72
probe	B4	0.642100	0.792990	0.640360	200000	100	discard	exp QL HD + pass + void n_table batch-72
probe	B4	0.641800	0.792780	0.640060	200000	100	discard	exp QM HD + pile deck<=2 + pass batch-72
probe	B4	0.642530	0.793220	0.640770	200000	100	discard	exp QN HD + void -10 global pile batch-72
probe	B4	0.642240	0.793010	0.640500	200000	100	discard	exp QO HD + pile deck<=2 + void batch-72
probe	B4	0.638300	0.791300	0.636560	200000	100	discard	exp QS HD ablate pair-open batch-73
probe	B4	0.642410	0.793210	0.640670	200000	100	discard	exp QT HD ablate void bonus batch-73
probe	B4	0.584430	0.756430	0.582690	200000	100	discard	exp QU HD ablate pile trump batch-73
probe	B4	0.626310	0.777310	0.624570	200000	100	discard	exp QV HD ablate pair-skip batch-73
probe	B4	0.643230	0.793650	0.642450	500000	100	discard	exp RA HD medium reconfirm batch-74
probe	B4	0.642530	0.793220	0.640770	200000	100	discard	exp RA HD dual reconfirm batch-74
probe	B4	0.641850	0.792870	0.640110	200000	100	discard	exp RB HD strip deck 0|2 batch-74
probe	B4	0.626050	0.776980	0.624310	200000	100	discard	exp RC HD strip deck==2 only batch-74
probe	B4	0.642410	0.793210	0.640670	200000	100	discard	exp RD HD ablate void batch-74
probe	B4	0.636780	0.789310	0.635040	200000	100	discard	exp RE HD strip deck<=1 batch-74
probe	B4	0.636070	0.788960	0.634330	200000	100	discard	exp RF CZ additive strip deck==2 batch-75
probe	B4	0.641570	0.791570	0.639830	200000	100	discard	exp RG HD strip opp==2 batch-75
probe	B4	0.636070	0.788960	0.634330	200000	100	discard	exp RH HD strip opp==1 deck>=1 batch-75
probe	B4	0.628510	0.779510	0.626770	200000	100	discard	exp RI HD pile opp<=4 batch-75
probe	B4	0.643480	0.793380	0.641740	500000	100	discard	exp RJ HD pair min+3 medium batch-75
probe	B4	0.62455	0.77623	0.62281	200000	100	discard	exp RK strip opp==1 only batch-76
probe	B4	0.59228	0.76010	0.59054	200000	100	discard	exp RL pile deck<=2 opp<=2 batch-76
probe	B4	0.63239	0.78725	0.63065	200000	100	discard	exp RM pair when hand>opp batch-76
probe	B4	0.62855	0.77823	0.62681	200000	100	discard	exp RN skip pile trump opp<=2 batch-76
probe	B4	0.63103	0.77947	0.62929	200000	100	discard	exp RO strip deck<=2 opp<=1 batch-76
probe	B4	0.63484	0.78858	0.6331	200000	100	discard	exp RP strip opp==2 only batch-77
probe	B4	0.60705	0.76748	0.60531	200000	100	discard	exp RQ pile deck<=2 opp<=3 batch-77
probe	B4	0.63200	0.78712	0.63026	200000	100	discard	exp RR pair when hand>=opp+2 batch-77
probe	B4	0.63607	0.78896	0.63433	200000	100	discard	exp RS void -10 pile opp<=3 batch-77
probe	B4	0.62003	0.77397	0.61829	200000	100	discard	exp RT pile trump opp>=4 batch-77
probe	B4	0.63143	0.77967	0.62969	200000	100	discard	exp RU pair deck>=4 CZ batch-78
probe	B4	0.57640	0.75216	0.57466	200000	100	discard	exp RV strip trump==1 deck==0 batch-78
probe	B4	0.63678	0.78931	0.63504	200000	100	discard	exp RW endgame pair deck<=1 batch-78
probe	B4	0.63753	0.78981	0.63579	500000	100	discard	exp RW endgame pair deck<=1 medium batch-78
probe	B4	0.63607	0.78896	0.63433	200000	100	discard	exp RX void -11/-4 asymmetric batch-78
probe	B4	0.63097	0.77944	0.62923	200000	100	discard	exp RY pile when hand>=3 batch-78
probe	B4	0.63607	0.78896	0.63433	200000	100	discard	exp SA endgame pair deck==0 CZ control batch-79
probe	B4	0.61784	0.77288	0.6161	200000	100	discard	exp SB endgame pair deck==1 only batch-79
probe	B4	0.63678	0.78931	0.63504	200000	100	discard	exp SC endgame pair deck<=1 RW batch-79
probe	B4	0.64253	0.79322	0.64079	200000	100	discard	exp SD endgame pair deck<=2 pair strip deck==0 batch-79
probe	B4	0.62605	0.77698	0.62431	200000	100	discard	exp SE endgame pair deck==2 only batch-79
probe	B4	0.64323	0.79365	0.64149	500000	100	discard	exp SD endgame pair deck<=2 medium batch-79
probe	B4	0.64253	0.79322	0.64079	200000	100	discard	exp SD endgame pair deck<=2 dual batch-79
probe	B4	0.64318	0.79358	0.64293	5000000	100	discard	exp SD endgame pair deck<=2 full batch-79
probe	B4	0.64318	0.79325	0.64144	200000	100	discard	exp SF SD+pair cap min+3 batch-80
probe	B4	0.64253	0.79322	0.64079	200000	100	discard	exp SG SD+void -10 pile opp<=3 batch-80
probe	B4	0.63384	0.78864	0.6321	200000	100	discard	exp SH SD+ablate strip batch-80
probe	B4	0.64224	0.79301	0.6405	200000	100	discard	exp SI SD+pile deck<=2 batch-80
probe	B4	0.63678	0.78931	0.63504	200000	100	discard	exp SJ SD+skip pair deck==2 batch-80
probe	B4	0.64348	0.79338	0.64174	500000	100	discard	exp SF SD+pair min+3 medium batch-80
probe	B4	0.64337	0.79335	0.64311	5000000	100	discard	exp SF SD+pair min+3 full batch-80
probe	B4	0.63830	0.79136	0.63656	200000	100	discard	exp SK SD+midgame pair-off batch-81
probe	B4	0.64241	0.79315	0.64067	200000	100	discard	exp SL SD+void bonus remove batch-81
probe	B4	0.64129	0.79249	0.63955	200000	100	discard	exp SM SD+pile pass hand==1 batch-81
probe	B4	0.62914	0.77853	0.6274	200000	100	discard	exp SN SD+endgame pair cap min+1 batch-81
probe	B4	0.58443	0.75617	0.58269	200000	100	discard	exp SO SD+ablate pile trump batch-81
probe	B4	0.64310	0.79358	0.64136	500000	100	discard	exp SL SD+void remove medium batch-81
probe	B4	0.64307	0.79352	0.64282	5000000	100	discard	exp SL SD+void remove full batch-81
probe	B4	0.63678	0.78931	0.63504	200000	100	discard	exp SP SD ablate deck==2 pair off batch-82
probe	B4	0.64253	0.79322	0.64079	200000	100	discard	exp SQ SD ablate deck==1 pair off batch-82
probe	B4	0.63830	0.79136	0.63656	200000	100	discard	exp SR SD ablate midgame pair off batch-82
probe	B4	0.63384	0.78864	0.6321	200000	100	discard	exp SS SD ablate strip off batch-82
probe	B4	0.58443	0.75617	0.58269	200000	100	discard	exp ST SD ablate pile trump off batch-82
probe	B4	0.63465	0.78986	0.63291	200000	100	discard	exp SU SD pair deck==2 only batch-82
probe	B4	0.64185	0.79287	0.64011	200000	100	discard	exp SV CZ+deck==2 pair additive batch-82
probe	B4	0.64251	0.79332	0.64077	500000	100	discard	exp SQ SD deck==1 pair off medium batch-82
probe	B4	0.64253	0.79322	0.64079	200000	100	discard	exp SX deck==2 pair hand>=4 batch-83
probe	B4	0.63678	0.78931	0.63504	200000	100	discard	exp SY deck==2 pair opp<=4 batch-83
probe	B4	0.64255	0.79323	0.64081	200000	100	discard	exp SZ deck==2 pair mnt<=6 batch-83
probe	B4	0.63678	0.78931	0.63504	200000	100	discard	exp TB deck==2 pair hand>=3 opp<=5 batch-83
probe	B4	0.64185	0.79287	0.64011	200000	100	discard	exp TA SV split blocks batch-83
probe	B4	0.64251	0.79332	0.64077	500000	100	discard	exp SW SV medium batch-83
probe	B4	0.64163	0.79253	0.63989	200000	100	discard	exp TC deck<=3 pair unified strip deck==0 batch-84
probe	B4	0.63830	0.79136	0.63656	200000	100	discard	exp TG SD midgame pair-off batch-84
probe	B4	0.63524	0.78835	0.6335	200000	100	discard	exp TD deck==3 pair additive batch-84
probe	B4	0.64253	0.79322	0.64079	200000	100	discard	exp TE deck 1|2 pair additive batch-84
probe	B4	0.64099	0.79223	0.63925	200000	100	discard	exp TF deck 2|3 pair additive batch-84
probe	B4	0.63678	0.78931	0.63504	200000	100	discard	exp TH SD deck==2 pair total<=10 batch-85
probe	B4	0.64253	0.79322	0.64079	200000	100	discard	exp TI SD deck==2 pair n_table==0 batch-85
probe	B4	0.64253	0.79322	0.64079	200000	100	discard	exp TJ SD deck==2 pair opp>=3 batch-85
probe	B4	0.64224	0.79301	0.6405	200000	100	discard	exp TK SD pile deck<=2 only batch-85
probe	B4	0.62043	0.77417	0.61869	200000	100	discard	exp TL SD strip trump>=2 deck==0 batch-85
probe	B4	0.64253	0.79322	0.64079	200000	100	discard	exp TM total gate total>10 only batch-86
probe	B4	0.63678	0.78931	0.63504	200000	100	discard	exp TN total gate total<=8 batch-86
probe	B4	0.63678	0.78931	0.63504	200000	100	discard	exp TO total gate total<=12 batch-86
probe	B4	0.64256	0.79324	0.64082	200000	100	discard	exp TP total gate total<=14 batch-86
probe	B4	0.64261	0.79329	0.64087	200000	100	discard	exp TQ total gate total<=16 batch-86
probe	B4	0.64337	0.79376	0.64163	500000	100	discard	exp TQ total<=16 medium batch-86
probe	B4	0.64332	0.79368	0.64307	5000000	100	discard	exp TQ total<=16 full batch-86
probe	B4	0.64256	0.79324	0.64082	200000	100	discard	exp TR total<=15 batch-87
probe	B4	0.64261	0.79329	0.64087	200000	100	discard	exp TS total<=17 batch-87
probe	B4	0.64257	0.79323	0.64083	200000	100	discard	exp TT total<=18 batch-87
probe	B4	0.64233	0.79308	0.64059	200000	100	discard	exp TU total<=16 pile deck<=2 batch-87
probe	B4	0.64261	0.79328	0.64087	200000	100	discard	exp TV TQ total<=16 dual batch-87
probe	B4	0.64337	0.79376	0.64163	500000	100	discard	exp TS total<=17 medium batch-87
probe	B4	0.64334	0.79373	0.6416	500000	100	discard	exp TR total<=15 medium batch-87
probe	B4	0.64337	0.79376	0.64163	500000	100	discard	exp TQ total<=16 medium batch-87
probe	B4	0.64328	0.79332	0.64154	200000	100	discard	exp TW TQ+pair min+3 batch-88
probe	B4	0.64250	0.79322	0.64076	200000	100	discard	exp TX TQ+void remove batch-88
probe	B4	0.64233	0.79308	0.64059	200000	100	discard	exp TY TQ+pile deck<=2 batch-88
probe	B4	0.63835	0.79141	0.63661	200000	100	discard	exp TZ TQ+midgame pair off batch-88
probe	B4	0.64261	0.79329	0.64087	200000	100	discard	exp UA TQ+total<=17 gate batch-88
probe	B4	0.64363	0.79348	0.64189	500000	100	discard	exp TW TQ+TW medium batch-88
probe	B4	0.64351	0.79345	0.64177	5000000	100	discard	exp TW full batch-88
probe	B4	0.64253	0.79322	0.64077	200000	100	discard	exp UB SD ablate TQ total gate off batch-89
probe	B4	0.63607	0.78896	0.63431	200000	100	discard	exp UC CZ ablate deck<=2 pair (SP ref) batch-89
probe	B4	0.64261	0.79329	0.64085	200000	100	discard	exp UD TQ deck==2 pair total 11-16 window batch-89
probe	B4	0.64261	0.79329	0.64085	200000	100	discard	exp UE TQ control midgame min+2 batch-89
probe	B4	0.64192	0.79294	0.64016	200000	100	discard	exp UF deck==2+total<=16 on CZ no deck==1 batch-89
probe	B4	0.64328	0.79332	0.64152	200000	100	discard	exp UG TW TQ+min+3 confirm batch-89
probe	B4	0.64337	0.79376	0.64163	500000	100	discard	exp UH TQ total<=16 medium reconfirm batch-89
probe	B4	0.63607	0.78896	0.63431	200000	100	discard	exp UI pass when only trump throw-ins deck>=4 batch-90
probe	B4	0.62690	0.77741	0.62514	200000	100	discard	exp UJ pass when throw-in is sole trump batch-90
probe	B4	0.63607	0.78896	0.63431	200000	100	discard	exp UK pile trump dump deck<=1 only batch-90
probe	B4	0.63607	0.78896	0.63431	200000	100	discard	exp UL open lowest trump when void nt==0 deck>=3 batch-90
probe	B4	0.63256	0.78679	0.63080	200000	100	discard	exp UM defense take when n_table>=5 batch-90
probe	B4	0.63578	0.78878	0.63402	200000	100	discard	exp UN pile throw-in highest non-trump junk batch-91
probe	B4	0.63607	0.78896	0.63431	200000	100	discard	exp UO defense same-suit cover tie-break batch-91
probe	B4	0.63592	0.78926	0.63416	200000	100	discard	exp UP open shed heavy-suit tie-break batch-91
probe	B4	0.63607	0.78896	0.63431	200000	100	discard	exp UQ void bonus open -10 pile -5 batch-91
probe	B4	0.61289	0.77040	0.61113	200000	100	discard	exp UR pile pass when throw-in rank > mnt+4 batch-91
probe	B4	0.62820	0.77806	0.62644	200000	100	discard	exp UX strip requires trumps>=2 batch-92
probe	B4	0.62690	0.77741	0.62514	200000	100	discard	exp UY pile trump requires trumps>=2 batch-92
probe	B4	0.62455	0.77623	0.62279	200000	100	discard	exp UZ strip only when opp==1 batch-92
probe	B4	0.61762	0.77277	0.61586	200000	100	discard	exp VA pile trump when hand>=4 cards batch-92
probe	B4	0.63596	0.78894	0.63420	200000	100	discard	exp VB midgame pair only deck>=6 batch-92
probe	B4	0.63607	0.78896	0.63431	200000	100	discard	exp VC pile trump opp<=3 batch-93
probe	B4	0.63607	0.78896	0.63431	200000	100	discard	exp VD pile trump opp<=4 batch-93
probe	B4	0.63607	0.78896	0.63431	200000	100	discard	exp VE pile trump opp<=6 batch-93
probe	B4	0.63607	0.78896	0.63431	200000	100	discard	exp VF pile trump opp<=7 batch-93
probe	B4	0.63578	0.78876	0.63402	200000	100	discard	exp VG pile trump opp<=5 deck<=2 batch-93
probe	B4	0.60718	0.76755	0.60542	200000	100	discard	exp VC pile trump opp<=3 batch-93
probe	B4	0.61906	0.77349	0.61730	200000	100	discard	exp VD pile trump opp<=4 batch-93
probe	B4	0.63487	0.78797	0.63311	200000	100	discard	exp VE pile trump opp<=6 batch-93
probe	B4	0.63490	0.78799	0.63314	200000	100	discard	exp VF pile trump opp<=7 batch-93
probe	B4	0.63578	0.78876	0.63402	200000	100	discard	exp VG pile trump deck<=2 opp<=5 batch-93
probe	B4	0.63607	0.78896	0.63431	200000	100	discard	exp VH pile throw-in rank-match table bonus batch-94
probe	B4	0.63607	0.78896	0.63431	200000	100	discard	exp VI open pair prefer table-matching rank batch-94
probe	B4	0.62386	0.77589	0.62210	200000	100	discard	exp VJ pile pass when n_table>=4 batch-94
probe	B4	0.63607	0.78896	0.63431	200000	100	discard	exp VK strip only when n_table==0 batch-94
probe	B4	0.63607	0.78896	0.63431	200000	100	discard	exp VL defense trump only vs trump attack batch-94
probe	B4	0.64261	0.79329	0.64085	200000	100	discard	exp VM TQ endgame integration quick batch-95
probe	B4	0.64337	0.79376	0.64161	500000	100	discard	exp VM TQ endgame integration medium batch-95
probe	B4	0.59993	0.76392	0.59817	200000	100	discard	exp VN pile pass n_table>=3 batch-95
probe	B4	0.63259	0.78714	0.63083	200000	100	discard	exp VO pile pass n_table>=5 batch-95
probe	B4	0.53013	0.72902	0.52837	200000	100	discard	exp VP pile pass n_table>=2 batch-95
probe	B4	0.64261	0.79329	0.64085	200000	100	discard	exp VQ TQ+pile rank-match bonus batch-96
probe	B4	0.64337	0.79376	0.64161	500000	100	discard	exp VQ TQ+pile rank-match bonus medium batch-96
probe	B4	0.62853	0.77822	0.62677	200000	100	discard	exp VR TQ+pile opp<=4 batch-96
probe	B4	0.64253	0.79328	0.64077	200000	100	discard	exp VS TQ+midgame pair deck>=6 batch-96
probe	B4	0.64325	0.79371	0.64149	500000	100	discard	exp VS TQ+midgame pair deck>=6 medium batch-96
probe	B4	0.63112	0.77952	0.62936	200000	100	discard	exp VT TQ+strip opp==1 batch-96
probe	B4	0.64261	0.79329	0.64085	200000	100	discard	exp VU TQ dual seed0 control batch-96
probe	B4	0.64261	0.79328	0.64085	200000	100	discard	exp VU TQ dual seed1 control batch-96
probe	B4	0.64247	0.79324	0.64071	200000	100	discard	exp VV TQ deck>=6 total<=15 batch-97
probe	B4	0.64323	0.79368	0.64147	500000	100	discard	exp VV TQ deck>=6 total<=15 medium batch-97
probe	B4	0.64253	0.79328	0.64077	200000	100	discard	exp VW TQ deck>=6 total<=17 batch-97
probe	B4	0.64325	0.79371	0.64149	500000	100	discard	exp VW TQ deck>=6 total<=17 medium batch-97
probe	B4	0.64247	0.79324	0.64071	200000	100	discard	exp VX TQ deck>=6 total<=14 batch-97
probe	B4	0.64323	0.79368	0.64147	500000	100	discard	exp VX TQ deck>=6 total<=14 medium batch-97
probe	B4	0.64253	0.79328	0.64077	200000	100	discard	exp VY TQ deck>=6 total<=16 control batch-97
probe	B4	0.64325	0.79371	0.64149	500000	100	discard	exp VY TQ deck>=6 total<=16 control medium batch-97
probe	B4	0.64261	0.79329	0.64085	200000	100	discard	exp VZ TQ total<=16 medium seed check batch-97
probe	B4	0.64337	0.79376	0.64161	500000	100	discard	exp VZ TQ total<=16 medium seed check medium batch-97
probe	B4	0.55759	0.74275	0.55583	200000	100	discard	exp WA defense rank cap +2 over attack batch-98
probe	B4	0.63607	0.78896	0.63431	200000	100	discard	exp WB attack prefer table-matching rank dump batch-98
probe	B4	0.63592	0.78926	0.63416	200000	100	discard	exp WC open shed light-suit tie-break batch-98
probe	B4	0.63607	0.78896	0.63431	200000	100	discard	exp WD pile void bonus -12 open -5 batch-98
probe	B4	0.02875	0.47833	0.02699	200000	100	discard	exp WE defense take when cover cost > atk+8 batch-98
probe	B4	0.63448	0.78838	0.63272	200000	100	discard	exp WF midgame pair cap min+1 batch-99
probe	B4	0.63360	0.78873	0.63184	200000	100	discard	exp WG endgame pair skip min+4 batch-99
probe	B4	0.61906	0.77349	0.61730	200000	100	discard	exp WH pile trump opp<=4 batch-99
probe	B4	0.62820	0.77806	0.62644	200000	100	discard	exp WI strip trumps>=2 opp<=2 batch-99
probe	B4	0.63607	0.78896	0.63431	200000	100	discard	exp WJ void open -6 pile -10 batch-99
probe	B4	0.63607	0.78896	0.63431	200000	100	discard	exp WL open trump hoard deck>2 +200 penalty batch-100
probe	B4	0.63604	0.78894	0.63428	200000	100	discard	exp WM void bonus only when deck<=4 batch-100
probe	B4	0.64261	0.79329	0.64085	200000	100	discard	exp WN TQ control quick batch-100
probe	B4	0.64337	0.79376	0.64161	500000	100	discard	exp WN TQ control quick medium batch-100
probe	B4	0.62204	0.77498	0.62028	200000	100	discard	exp WO TQ+pile trump deck<=1 only batch-100
probe	B4	0.64261	0.79329	0.64085	200000	100	discard	exp WP TQ+pile rank-match batch-100
probe	B4	0.64337	0.79376	0.64161	500000	100	discard	exp WP TQ+pile rank-match medium batch-100
probe	B4	0.63112	0.77952	0.62936	200000	100	discard	exp WQ TQ strip opp==1 only batch-101
probe	B4	0.64396	0.79451	0.64220	200000	100	discard	exp WR TQ pile hand>=opp batch-101
probe	B4	0.64480	0.79505	0.64304	500000	100	discard	exp WR TQ pile hand>=opp medium batch-101
probe	B4	0.60407	0.76599	0.60231	200000	100	discard	exp WS TQ skip throw-in n_table>=3 batch-101
probe	B4	0.64256	0.79324	0.64080	200000	100	discard	exp WT TQ total gate <=14 batch-101
probe	B4	0.64334	0.79373	0.64158	500000	100	discard	exp WT TQ total gate <=14 medium batch-101
probe	B4	0.64257	0.79323	0.64081	200000	100	discard	exp WU TQ total gate <=18 batch-101
probe	B4	0.64330	0.79369	0.64154	500000	100	discard	exp WU TQ total gate <=18 medium batch-101
f5bb135	B4	0.64489	0.79506	0.64464	10000000	100	keep	exp WR TQ pile hand>=opp batch-101 full
